{
  "model": "Example model (sample values only)",
  "dataset": "CICIDS2017",
  "split": "Train on some days, test on a held-out day (sample text)",
  "precision": 0.0,
  "recall": 0.0,
  "f1": 0.0,
  "false_positive_rate": 0.0,
  "notes": "Sample file. Real numbers come from DETECT's offline evaluation."
}
