{
  "model": "LCCDE ensemble (LightGBM + XGBoost + CatBoost), leaders chosen on a validation split",
  "dataset": "CICIDS2017 (5% sample from the Western OC2 Lab repository)",
  "split": "Stratified random 80/20 split after removing duplicate rows (not ordered by time), seed 0",
  "precision": 0.9978,
  "recall": 0.9971,
  "f1": 0.9974,
  "false_positive_rate": 0.0023,
  "notes": "Attack = any class except BENIGN. 44043 rows after removing 12537 duplicates. Share of each attack type still flagged as an attack when the model was trained WITHOUT it: Bot 0.00, BruteForce 0.06, DoS 0.03, Infiltration 0.00, PortScan 0.04, WebAttack 0.01. This is lab data from a public sample, not live traffic, and it is not comparable with NIDS's live Isolation Forest detector."
}
